,product_links,product_name,product_price
0,https://m.media-amazon.com/images/I/61lUOdLYtwL._AC_UL320_.jpg,"Ek Retail Shop Car Body Covers for Hyundai i10 Grand Magna at 1.2 Kappa VTVT with Mirror Pockets, Triple Stitching & Light Weight (Navy Blue & RED Color)",999
1,https://m.media-amazon.com/images/I/51X2SPSXx+L._AC_UL320_.jpg,ROYALS CHOICE Water Resistant Car Cover for New Maruti Suzuki Wagon R VXI Opt 1.2 2019 (Strips Red with Mirror Pockets),"1,189"
2,https://m.media-amazon.com/images/I/71EGJz+SeqL._AC_UL320_.jpg,CARMATE Parachute Custom Fitting Waterproof Car Body Cover for Chevrolet Sail Uva - Blue (Without Side Mirror & Antenna Pockets),"1,417"
3,https://m.media-amazon.com/images/I/617MTDTXtzL._AC_UL320_.jpg,"EKRS Waterproof Car Body Covers for Hyundai Venue with Mirror Pockets, Triple Stitching & Light Weight (Navy Blue & RED Color)","1,399"
4,https://m.media-amazon.com/images/I/61vb6LHsqpL._AC_UL320_.jpg,boAt Dual Port Rapid Car Charger (Qualcomm Certified) with Quick Charge 3.0 + Free Micro USB Cable - (Black),499
5,https://m.media-amazon.com/images/I/71SJiQ4wAbL._AC_UL320_.jpg,Kawachi Car Travel Inflatable Sofa Mattress Air Bed Cushion Camping Bed Rear Seat With Pillow And Pump,"1,690"
6,https://m.media-amazon.com/images/I/71YlfEoxSYL._AC_UL320_.jpg,Lukzer 1 PC Leather PU Car Console Side Storage Organizer Seat Gap Filler Pockets Catch Caddy (Black),649
7,https://m.media-amazon.com/images/I/71F7eODBQgL._AC_UL320_.jpg,RNG EKO Green RNG-2001 Car Handheld Vacuum Cleaner (White),"1,545"
8,https://m.media-amazon.com/images/I/71v6o+eJLdL._AC_UL320_.jpg,AmazonBasics Compact Portable Digital Tyre Inflator with Carrying Case,"2,149"
9,https://m.media-amazon.com/images/I/51jVgbeQmHL._AC_UL320_.jpg,"LAZI Multipurpose Car AC vent Interior Dust Cleaning Gel Jelly Detailing Putty Cleaner Kit Universal Car Interior, Keyboard, PC, Latop, Electronic Gadget Cleaning Kit (PACK OF 1)",199
10,https://m.media-amazon.com/images/I/41DVFPlXpSL._AC_UL320_.jpg,"Tony Stark Microfiber Flexible Duster Car Wash | Car Cleaning Accessories | Microfiber | Brushes | Dry / Wet Home, Kitchen, Office Cleaning Brush with Expandable Handle",280
11,https://m.media-amazon.com/images/I/61eVdVECoIL._AC_UL320_.jpg,Lukzer 1 Pc Dashboard Mat Multifunction Stable Anti-Slip Car Phone Mount/Non-Slip Mat Phone Dashboard Pad Mat/Navigation Holder Tray with Parking Phone Number Applies (Red),499
12,https://m.media-amazon.com/images/I/518+uUUrMtL._AC_UL320_.jpg,QAWACHH Universal Waterproof Anti Fog Car Film Rainproof Anti-Water Film Rear-View Mirror Size-150 100mm,399
13,https://m.media-amazon.com/images/I/41DPe-umZPL._AC_UL320_.jpg,SHREEJIIH Auto Cool- Solar Powered Ventilation Fan Keeps Your Parked Car Cool -Black,555
14,https://m.media-amazon.com/images/I/61FePQvChbL._AC_UL320_.jpg,BLACK+DECKER AV1205 12V Powerful Dustbuster Car Vacuum Cleaner (Grey),"1,299"
15,https://m.media-amazon.com/images/I/81SDecrhJaL._AC_UL320_.jpg,Autofurnish 3D Car Auto Seat Back Multi Pocket Storage Bag Organizer with Car Meal Tray,749
16,https://m.media-amazon.com/images/I/81VtvcWmc6L._AC_UL320_.jpg,AmazonBasics Emergency Seat Belt Cutter and Window Hammer,239
17,https://m.media-amazon.com/images/I/81vkmkMpMcL._AC_UL320_.jpg,SHEEBA - SMLTK5 Multi Surface Car Polish and Scratch Remover Kit (Pack of 3),284
18,https://m.media-amazon.com/images/I/51ScG0aikgL._AC_UL320_.jpg,"LXCN® 360° Rotation Mobile Holder for Car, Dashboard Cell Phone Holder, Smartphone Holder Fit for All Smartphones- (Black)",360
19,https://m.media-amazon.com/images/I/71xV8F+pCwL._AC_UL320_.jpg,HSR 10PCS/1Set Car Wiper Detergent Effervescent Tablets Washer Auto Windshield Cleaner Glass Wash Cleaning Compact Concentrated Tools (10),199
20,https://m.media-amazon.com/images/I/6102P37Sl+L._AC_UL320_.jpg,"DOUBLE R BAGS Multi Compartments Collapsible Portable car Accessories for Trunk Dicky Organizer for Garage, SUV, Cars, Minivan (Black)","1,699"
21,https://m.media-amazon.com/images/I/616bd3xYylL._AC_UL320_.jpg,Almoda Creations Satyamev Jayate Indian Cross Flag for Car Dashboard & Official use,199
22,https://m.media-amazon.com/images/I/51yE17MCoUL._AC_UL320_.jpg,"HOTKEI Universal Back Seat Car Organizer Multi-Pocket Backseat Storage Bag for Documents, Water Bottle, Tablet, Mobile Phone Accessories Holder (Black)",469
23,https://m.media-amazon.com/images/I/81tF9mxQj4L._AC_UL320_.jpg,MEGUIAR'S G19216 Ultimate Polish,821
24,https://m.media-amazon.com/images/I/71scaaOZ9bL._AC_UL320_.jpg,SOFTSPUN Microfiber Cloth - 4 pcs - 40x40 cms - 340 GSM Grey- Thick Lint & Streak-Free Multipurpose Cloths - Automotive Microfibre Towels for Car Bike Cleaning Polishing Washing & Detailing,299
25,https://m.media-amazon.com/images/I/81deYHT91TL._AC_UL320_.jpg,Sheen 300 GSM Microfiber Cleaning Cloth (30x35cm) - Pack of 10,321
26,https://m.media-amazon.com/images/I/31wylDxkJ9L._AC_UL320_.jpg,"NAPTR Leg Rest Pillow For Travel, Adjustable Foot Rest Pillow for Travel, Home and Office (Grey)","1,499"
27,https://m.media-amazon.com/images/I/71vgxuFZVhL._AC_UL320_.jpg,APPUCOCO Mini Car Trash Bin Can Holder Dustbin - Black (L 17 x W 6.5 cms),299
28,https://m.media-amazon.com/images/I/41Om7suXOeL._AC_UL320_.jpg,"Hetvi trend ARLICODECKâ ¢ Double Sided Adhesive Tape, Transparent Strong Adhesive Traceless Tape Removable Washable and Reusable Anti Slip Tape for Home Supplies | 3 Meter",289
29,https://m.media-amazon.com/images/I/61yE4xmBSrL._AC_UL320_.jpg,"QAWACHH Universal Wireless Waterproof Car Door 5 LED Opened Warning Flash Light, Red (2Pairs 4Pcs with 4 Cell)",699
30,https://m.media-amazon.com/images/I/51IHjwDsYAL._AC_UL320_.jpg,DEFENNA Car Seat Pockets PU Leather Car Console Side Organizer Seat Gap Filler Catch Caddy with Non-Slip Mat 9.2x6.5x2.1 inch Black,799
31,https://m.media-amazon.com/images/I/71YsSMnxzfL._AC_UL320_.jpg,"Rally R000246 4x 9 LED RGB Car Interior Decorative Light Floor Atmosphere Strip Light Car Under Dash Interior LED Lighting Kit with Sounds Activated Wireless IR Remote Control (6W, Multicolor)",390
32,https://m.media-amazon.com/images/I/61fogsshKdL._AC_UL320_.jpg,AmazonBasics 4.0 Amp Dual USB Car Charger for Apple and Android Devices - Black,579
33,https://m.media-amazon.com/images/I/81va0xrlwIL._AC_UL320_.jpg,"HSR Inflatable Car Bed Mattress with Two Air Pillows, Car Air Pump and Repair Kit (Multi Color)","1,999"
34,https://m.media-amazon.com/images/I/61jdd+wgGsL._AC_UL320_.jpg,OnWheel car Bead seat Wooden Cushion Cover pad for Acupressure Sitting in Cream Color (1 pc),648
35,https://m.media-amazon.com/images/I/61LY6RxCRxL._AC_UL320_.jpg,boAt Dual Port Rapid Car Charger (Qualcomm Certified) Smart Charging with Quick Charge 3.0 (Black),449
36,https://m.media-amazon.com/images/I/91sNJ6eIy4L._AC_UL320_.jpg,"AmazonBasics Trunk Organizer with Collapsible Design for Cars, SUVs, and Trucks - Black","1,399"
37,https://m.media-amazon.com/images/I/61HXag7Lk3L._AC_UL320_.jpg,CarEmpire Universal Car Dashboard Analog Clock with Vent Clip and Adhesive Tape,529
38,https://m.media-amazon.com/images/I/613cQASV1DL._AC_UL320_.jpg,FABTEC Rubber Car Bumper Protector Guard with Double Chrome Strip for Car 4Pcs - Black (for All car),299
39,https://m.media-amazon.com/images/I/71TPVHK8KaL._AC_UL320_.jpg,"Fusion PVC Car Sticker, 0.19 x 23.22 x 2.67 Inches, Black",209
40,https://m.media-amazon.com/images/I/61Qlaky6SdL._AC_UL320_.jpg,NIKAVI Portable Leather Rectangular Tissue Cover Box Holders Case Pumping Paper Car Hotel Home Gift (RED LINE),384
41,https://m.media-amazon.com/images/I/51jEfgwJIyL._AC_UL320_.jpg,"Inditradition Universal Car Back Seat Headrest Hook | Hanging Holder for Purse, Bags, Polybags, Handbags, Groceries (Pack of 2) (Black)",275
42,https://m.media-amazon.com/images/I/51tyBRf8wjL._AC_UL320_.jpg,"Coleman Ice Box 5Qt Flip Lid Blue, 4.7 L","1,175"
43,https://m.media-amazon.com/images/I/61bWKhP60TL._AC_UL320_.jpg,"Portronics CAR CLAMP, a Magnetic Air Vent Mobile Holding Mount with Strong Magnetic Holder, 360 Degree Rotation, Easy Mounting Dis-Mounting, Easy Charging (Black)",299
44,https://m.media-amazon.com/images/I/71vyk2DAOfL._AC_UL320_.jpg,"NIKAVI Leather Card Clip Car Visor Tissue Holder Mount, Hanging Tissue Holder Case for Car Seat Back, Multi-use Paper Towel Cover Case with One Tissue Refill for Car & Truck Decoration (Black)","1,302"
45,https://m.media-amazon.com/images/I/61LDt2SXrfL._AC_UL320_.jpg,HSR Multifunction Car Dashboard Phone GPS Holder Anti-Slip Silicone Pad and Car Mobile Holders for Dashboard (Phone Area Size 16cm),549
46,https://m.media-amazon.com/images/I/61h-M-YC5UL._AC_UL320_.jpg,AmazonBasics Car Window Pullover Sun Shade - 2-Pack,659
47,https://m.media-amazon.com/images/I/5135FEKVaJL._AC_UL320_.jpg,"Automaze 3R Car Rear Double View Blind Spot Parking Mirror Adjustable Wide Angle, Blind Spot For Car Tyre (Left)",595
48,https://m.media-amazon.com/images/I/71RD3kW5fQL._AC_UL320_.jpg,Sevia Silicon Gel Sitter Soft Silicone Breathable Cushion Memory Seat Pillow with Non-Slip Cover for Home/Office/Car/Wheelchair Essential Accessory,689
49,https://m.media-amazon.com/images/I/81I7ZEP8I8L._AC_UL320_.jpg,"Autofit Double Quilted Combo Set/Car Neckrest Pillow + Car Cushion (Set of 4, Black and Silver)","1,299"
50,https://m.media-amazon.com/images/I/81u4v3oILSL._AC_UL320_.jpg,"Adroitz Neck Cushion (Black, Pack of 2)",245
51,https://m.media-amazon.com/images/I/51nsG53QJ+L._AC_UL320_.jpg,LIOOBO Monk Car Dashboard Ornaments Cute Tabletop Dancing Toys -4 Pieces/Set,498
52,https://m.media-amazon.com/images/I/51rKlUFIYhL._AC_UL320_.jpg,"Divya Mantra Tibetan Prayer Flags, Wind Outdoor Flags, Car Jewelry Decor Accessories Flag Decorations, Buddhist Items Om Mani Padme Hum Peace Sign Wall Flag, Hanging For Car / Bike 2.5 Ft - Multicolor",199
53,https://m.media-amazon.com/images/I/81PQyd0iEEL._AC_UL320_.jpg,SOFTSPUN Microfiber Cloth - 5 pcs - 40x40 cms - 340 GSM Multi-Color - Thick Lint & Streak-Free Multipurpose Cloths - Automotive Microfibre Towels for Car Bike Cleaning Polishing Washing & Detailing,355
54,https://m.media-amazon.com/images/I/81Zm7vm0udL._AC_UL320_.jpg,NEXTON Car Washing and Cleaning Duster with Smooth Microfibers and Hand Grip Elastic_Multicolor (1 Pc.),160
55,https://m.media-amazon.com/images/I/71q6mLx85wL._AC_UL320_.jpg,Lukzer Car Accessories Combo (2 PC) – 1 PC Microfiber Car Cleaning Retractable Brush Duster + 1 PC Multipurpose Car Cleaning Sponge (Random color),510
56,https://m.media-amazon.com/images/I/71AJnf2nyYL._AC_UL320_.jpg,"BKN BuyKarNow Car Dashboard Mat Anti-Slip Gel, Non-Slip Mounting Pad for Cell Phone, Sunglasses, Keys and More (Black)",224
57,https://m.media-amazon.com/images/I/41p3Cw0PwbL._AC_UL320_.jpg,JIC PRODUCTS® CAR TOWING BELT 50MM X 3MTR LONG HEAVY DUTY STRAP WITH TWO HEAVY D CLAMPS FOR VEHICLE TOWING (ORANGE/RED/BLUE/YELLOW),633
58,https://m.media-amazon.com/images/I/71PjijnuoyL._AC_UL320_.jpg,Caper Cool Pad Car Seat Cushion Black and Grey (Set of 3),"2,223"
59,https://m.media-amazon.com/images/I/61Fcl7EcjcL._AC_UL320_.jpg,MotRoX Dual Tone Car Body Cover for Volkswagen Vento (Navy Blue and Grey with Side Mirror Pockets),"1,009"
